{
  "schema_version": "ocme-core-atlas-v0.1",
  "atlas_version": "0.10.0",
  "title_zh": "OCME 核心數學地圖",
  "design_note_zh": "Atlas 節點是網站導航與本地 AI materialization queue；只有 maturity=canonical_mko 的節點等同已存在 Canonical MKO。",
  "groups": [
    {"id":"numbers","title_zh":"數與運算","expected_count":10},
    {"id":"sets_logic","title_zh":"集合與邏輯","expected_count":10},
    {"id":"algebra","title_zh":"代數與方程","expected_count":12},
    {"id":"geometry","title_zh":"幾何與向量","expected_count":12},
    {"id":"functions","title_zh":"函數與圖形","expected_count":10},
    {"id":"calculus","title_zh":"微積分基礎","expected_count":12},
    {"id":"probability","title_zh":"機率與統計","expected_count":8},
    {"id":"discrete","title_zh":"離散數學","expected_count":6}
  ],
  "entries": [
    {"id":"atlas-natural-number","title_zh":"自然數","group":"numbers","primary_domain":"arithmetic_number_systems","object_kind":"concept","summary_zh":"用於計數與離散次序的基本數系。","prerequisites":[],"methods":["method-direct-proof"],"curriculum_band":"primary_foundation","difficulty":{"prerequisite_depth":1,"prerequisite_breadth":1,"abstraction_level":1,"conceptual_discontinuity":1,"notation_density":1,"proof_burden":1,"computational_burden":2,"search_construction_burden":1,"representation_switching":1,"exception_boundary_density":1,"intuition_accessibility":5,"formalization_burden":2},"maturity":"canonical_mko","canonical_mko_id":"mko-natural-number","target_mko_id":"mko-natural-number","materialization_priority":"canonical"},
    {"id":"atlas-integer","title_zh":"整數","group":"numbers","primary_domain":"arithmetic_number_systems","object_kind":"concept","summary_zh":"由自然數擴張得到，可表示正、負與零的數系。","prerequisites":["atlas-natural-number"],"methods":["method-construction"],"curriculum_band":"lower_secondary","difficulty":{"prerequisite_depth":2,"prerequisite_breadth":1,"abstraction_level":2,"conceptual_discontinuity":2,"notation_density":2,"proof_burden":2,"computational_burden":3,"search_construction_burden":2,"representation_switching":2,"exception_boundary_density":2,"intuition_accessibility":4,"formalization_burden":3},"maturity":"atlas_seed","target_mko_id":"mko-integer","materialization_priority":"P1"},
    {"id":"atlas-rational-number","title_zh":"有理數","group":"numbers","primary_domain":"arithmetic_number_systems","object_kind":"concept","summary_zh":"可表示為兩個整數之比的數。","prerequisites":["atlas-integer"],"methods":["method-construction"],"curriculum_band":"lower_secondary","difficulty":{"prerequisite_depth":2,"prerequisite_breadth":1,"abstraction_level":2,"conceptual_discontinuity":2,"notation_density":2,"proof_burden":2,"computational_burden":3,"search_construction_burden":2,"representation_switching":2,"exception_boundary_density":2,"intuition_accessibility":4,"formalization_burden":3},"maturity":"atlas_seed","target_mko_id":"mko-rational-number","materialization_priority":"P1"},
    {"id":"atlas-real-number","title_zh":"實數","group":"numbers","primary_domain":"analysis","object_kind":"concept","summary_zh":"包含有理數與無理數，支撐連續量與實分析。","prerequisites":["atlas-rational-number"],"methods":["method-construction"],"curriculum_band":"upper_secondary","difficulty":{"prerequisite_depth":4,"prerequisite_breadth":3,"abstraction_level":4,"conceptual_discontinuity":4,"notation_density":4,"proof_burden":4,"computational_burden":3,"search_construction_burden":4,"representation_switching":4,"exception_boundary_density":4,"intuition_accessibility":3,"formalization_burden":5},"maturity":"atlas_seed","target_mko_id":"mko-real-number","materialization_priority":"P1"},
    {"id":"atlas-arithmetic-operations","title_zh":"四則運算","group":"numbers","primary_domain":"arithmetic_number_systems","object_kind":"operation","summary_zh":"加、減、乘、除及其基本規則。","prerequisites":["atlas-natural-number"],"methods":["method-direct-proof"],"curriculum_band":"primary_foundation","difficulty":{"prerequisite_depth":1,"prerequisite_breadth":1,"abstraction_level":1,"conceptual_discontinuity":1,"notation_density":1,"proof_burden":1,"computational_burden":2,"search_construction_burden":1,"representation_switching":1,"exception_boundary_density":1,"intuition_accessibility":5,"formalization_burden":2},"maturity":"atlas_seed","target_mko_id":"mko-arithmetic-operations","materialization_priority":"P1"},
    {"id":"atlas-fraction","title_zh":"分數","group":"numbers","primary_domain":"arithmetic_number_systems","object_kind":"representation","summary_zh":"以部分與整體或比值表示有理量。","prerequisites":["atlas-arithmetic-operations"],"methods":["method-coordinate"],"curriculum_band":"primary_foundation","difficulty":{"prerequisite_depth":2,"prerequisite_breadth":1,"abstraction_level":2,"conceptual_discontinuity":2,"notation_density":2,"proof_burden":2,"computational_burden":3,"search_construction_burden":2,"representation_switching":2,"exception_boundary_density":2,"intuition_accessibility":4,"formalization_burden":3},"maturity":"atlas_seed","target_mko_id":"mko-fraction","materialization_priority":"P1"},
    {"id":"atlas-ratio-proportion","title_zh":"比與比例","group":"numbers","primary_domain":"arithmetic_number_systems","object_kind":"relation","summary_zh":"比較兩個量並研究成比例的關係。","prerequisites":["atlas-fraction"],"methods":["method-direct-proof"],"curriculum_band":"lower_secondary","difficulty":{"prerequisite_depth":2,"prerequisite_breadth":1,"abstraction_level":2,"conceptual_discontinuity":2,"notation_density":2,"proof_burden":2,"computational_burden":3,"search_construction_burden":2,"representation_switching":2,"exception_boundary_density":2,"intuition_accessibility":4,"formalization_burden":3},"maturity":"atlas_seed","target_mko_id":"mko-ratio-proportion","materialization_priority":"P1"},
    {"id":"atlas-power-root","title_zh":"冪與根","group":"numbers","primary_domain":"algebra","object_kind":"operation","summary_zh":"描述重複乘法及其逆向關係。","prerequisites":["atlas-arithmetic-operations"],"methods":["method-direct-proof"],"curriculum_band":"lower_secondary","difficulty":{"prerequisite_depth":3,"prerequisite_breadth":2,"abstraction_level":3,"conceptual_discontinuity":3,"notation_density":3,"proof_burden":3,"computational_burden":3,"search_construction_burden":3,"representation_switching":3,"exception_boundary_density":3,"intuition_accessibility":4,"formalization_burden":4},"maturity":"atlas_seed","target_mko_id":"mko-power-root","materialization_priority":"P1"},
    {"id":"atlas-absolute-value","title_zh":"絕對值","group":"numbers","primary_domain":"analysis","object_kind":"function","summary_zh":"表示數與零之間的非負距離。","prerequisites":["atlas-integer"],"methods":["method-coordinate"],"curriculum_band":"lower_secondary","difficulty":{"prerequisite_depth":3,"prerequisite_breadth":2,"abstraction_level":3,"conceptual_discontinuity":3,"notation_density":3,"proof_burden":3,"computational_burden":3,"search_construction_burden":3,"representation_switching":3,"exception_boundary_density":3,"intuition_accessibility":4,"formalization_burden":4},"maturity":"atlas_seed","target_mko_id":"mko-absolute-value","materialization_priority":"P1"},
    {"id":"atlas-order-relation","title_zh":"大小與順序","group":"numbers","primary_domain":"foundations_logic","object_kind":"relation","summary_zh":"描述數之間的小於、大於與次序結構。","prerequisites":["atlas-natural-number"],"methods":["method-direct-proof"],"curriculum_band":"primary_foundation","difficulty":{"prerequisite_depth":2,"prerequisite_breadth":1,"abstraction_level":2,"conceptual_discontinuity":2,"notation_density":2,"proof_burden":2,"computational_burden":3,"search_construction_burden":2,"representation_switching":2,"exception_boundary_density":2,"intuition_accessibility":4,"formalization_burden":3},"maturity":"atlas_seed","target_mko_id":"mko-order-relation","materialization_priority":"P1"},

    {"id":"atlas-set","title_zh":"集合","group":"sets_logic","primary_domain":"foundations_logic","object_kind":"concept","summary_zh":"把對象視為一個整體的基本數學結構。","prerequisites":[],"methods":["method-direct-proof"],"curriculum_band":"upper_secondary","difficulty":{"prerequisite_depth":3,"prerequisite_breadth":2,"abstraction_level":3,"conceptual_discontinuity":3,"notation_density":3,"proof_burden":3,"computational_burden":3,"search_construction_burden":3,"representation_switching":3,"exception_boundary_density":3,"intuition_accessibility":4,"formalization_burden":4},"maturity":"canonical_mko","canonical_mko_id":"mko-set","target_mko_id":"mko-set","materialization_priority":"canonical"},
    {"id":"atlas-set-membership","title_zh":"集合隸屬","group":"sets_logic","primary_domain":"foundations_logic","object_kind":"relation","summary_zh":"描述元素是否屬於某個集合。","prerequisites":["atlas-set"],"methods":["method-direct-proof"],"curriculum_band":"upper_secondary","difficulty":{"prerequisite_depth":2,"prerequisite_breadth":1,"abstraction_level":2,"conceptual_discontinuity":2,"notation_density":2,"proof_burden":2,"computational_burden":3,"search_construction_burden":2,"representation_switching":2,"exception_boundary_density":2,"intuition_accessibility":4,"formalization_burden":3},"maturity":"canonical_mko","canonical_mko_id":"mko-set-membership","target_mko_id":"mko-set-membership","materialization_priority":"canonical"},
    {"id":"atlas-subset","title_zh":"子集合","group":"sets_logic","primary_domain":"foundations_logic","object_kind":"relation","summary_zh":"描述一個集合的每個元素都屬於另一集合。","prerequisites":["atlas-set-membership"],"methods":["method-direct-proof"],"curriculum_band":"upper_secondary","difficulty":{"prerequisite_depth":3,"prerequisite_breadth":2,"abstraction_level":3,"conceptual_discontinuity":3,"notation_density":3,"proof_burden":3,"computational_burden":3,"search_construction_burden":3,"representation_switching":3,"exception_boundary_density":3,"intuition_accessibility":4,"formalization_burden":4},"maturity":"atlas_seed","target_mko_id":"mko-subset","materialization_priority":"P1"},